"Experimental Testing of a Real-Time Implementation of a PMU-Based Wide-Area Damping Control System","E. Rebello; L. Vanfretti; M. S. Almas","Wind Energy Institute of Canada, Tignish, Canada; Department of Electrical, Computer, and Systems Engineering, Rensselaer Polytechnic Institute, Troy, USA; ABB HVDC, Ludvika, Sweden","IEEE Access","10 Feb 2020","2020","8","","25800","25810","The modern power grid is being used under operating conditions of increasing stress, giving rise to grid stability issues. One of these stability issues is the phenomenon of inter-area oscillations. Simulations have demonstrated the advantages of Wide-area Measurement Signals (WAMS)-based Oscillation Damping Controls in achieving improved electromechanical mode damping compared to traditional, local signal-based Power System Stabilizers (PSS). This work takes an existing Phasor-based oscillation damping (POD) algorithm and uses it to implement a proof-of-concept, wide-area, real-time controller on National Instruments hardware. The developed prototype is tested in a real-time Hardware-in-the-loop setup (RT-HIL) using OPAL-RT's eMEGASIM real-time simulation platform and synchrophasor data from actual Phasor Measurement Units (PMUs). The prototype and experiments provide insight into the feasibility and real-world limitations of wide-area controls. Further, it is demonstrated how the proposed control architecture has applications independent of the controlled power system device. Challenges faced, the solutions implemented together with the present prototype's limitations are also discussed.","2169-3536","","10.1109/ACCESS.2020.2970988","National Science Foundation; U.S. Department of Energy(grant numbers:EEC-1041877); CURENT Industry Partnership Program; Nordic Energy Research; ","https://ieeexplore.ieee.org/stamp/stamp.jsp?arnumber=8977519","Power system dynamics;power system stability;power system simulation;power generation control;phasor measurement units","Damping;Real-time systems;Oscillators;Phasor measurement units;Power system stability;Hardware;Testing","damping;hardware-in-the loop simulation;phasor measurement;power generation control;power grids;power system simulation;power system stability","phasor measurement units;control architecture;experimental testing;real-time implementation;inter-area oscillations;electromechanical mode damping;real-time controller;real-time hardware-in-the-loop setup;synchrophasor data;PMU-based wide-area damping control system;wide-area measurement signals-based oscillation damping controls;WAMS;local signal-based power system stabilizers;PSS;phasor-based oscillation damping algorithm;power system device control;RT-HIL;OPAL-RTs eMEGASIM real-time simulation platform;modern power grid stability issues","","10","","33","CCBY","31 Jan 2020","","","IEEE","IEEE Journals"
"Stability and performance of underwater gliders","S. Fan; A. Wolek; C. A. Woolsey","Mechanical Engineering, Zhejiang University, P.R. China; Mechanical Engineering, Zhejiang University, P.R. China; Mechanical Engineering, Zhejiang University, P.R. China","2012 Oceans","10 Jan 2013","2012","","","1","10","Underwater gliders are efficient mobile sensor platforms that can be deployed for months at a time, traveling thousands of kilometers. As with any vehicle, different applications impose different mission requirements which impact vehicle design. In this paper, we consider a conventional glider configuration and investigate the relationship between geometry and the stability and performance characteristics. We consider two specific flight conditions: minimum drag and maximum horizontal speed. Configuration parameters of interest include the fineness ratio of the hull; the wing position, wingspan, and aspect ratio; and the area and position of the vertical stabilizer.","0197-7385","978-1-4673-0831-1","10.1109/OCEANS.2012.6404993","","https://ieeexplore.ieee.org/stamp/stamp.jsp?arnumber=6404993","","Vehicles;Drag;Geometry;Hydrodynamics;Pistons;Vectors;Stability analysis","design engineering;mechanical stability;sensors;underwater vehicles","underwater glider stability;underwater glider performance;mobile sensor platforms;mission requirements;vehicle design;conventional glider configuration;specific flight conditions;minimum drag;maximum horizontal speed;wing position;wingspan;aspect ratio;hull fineness ratio;vertical stabilizer","","5","","14","IEEE","10 Jan 2013","","","IEEE","IEEE Conferences"
"A 1 mJ/Frame Unified Media Application Processor With Dynamic Analog-Digital Mode Reconfiguration for Embedded 3D-Media Contents Processing","H. -E. Kim; J. -S. Park; J. -S. Yoon; S. -H. Kim; L. -S. Kim","Samsung Electronics, Giheung, South Korea; Korea Advanced Institute of Science and Technology, Daejeon, South Korea; Samsung Electronics, Giheung, South Korea; Samsung Electronics, Giheung, South Korea; Korea Advanced Institute of Science and Technology, Daejeon, South Korea","IEEE Journal of Solid-State Circuits","19 Jul 2013","2013","48","8","1970","1985","In this paper, a unified media application processor (UMAP) is presented for 2D/3D image analysis/synthesis applications on handheld devices. UMAP integrates parallel and sequential processing layers which consist of heterogeneous functional IPs for general media contents processing on today's application processors (AP). Based on the heterogeneous many-core platform, UMAP supports not only graphics and vision processing for real-time augmented reality (AR) but also disparity estimation and 3D display synthesis for 3D-view AR acceleration. A new concept of 3D-view AR which synthesizes 3D display contents from two vertically aligned stereo images and a self-constructed disparity map is introduced to achieve true realism for next generation mobile devices. For low-cost 3D-view AR processing, a homography-based disparity estimation (HDE) algorithm is proposed to construct a disparity map between two stereo images with small implementation overhead. For real-time and energy-efficient system organization, workload-balanced 3-stage pipelined architecture and a mixed-mode feature extraction engine (FEE) are also implemented in UMAP. The 3-stage pipelined system which consists of graphics, vision, and display operation stages reduces per-frame execution latency, while dynamic analog/digital mode reconfiguration based on mixed-mode FEE reduces per-frame energy dissipation, so real-time energy-efficient 3D-view AR can be realized in UMAP. FEE performs high-speed corner detection for vision processing based on four pairs of analog current contention logics (CCLs). Especially, a diode-connected current sensing stabilizer (CSS) in each CCL reduces minimum sensing current for corner detection, so average power consumed in CCL is reduced by 44.9%. In 2D or 3D-view AR processing, FEE with four CCLs replaces the parallel processing core cluster which is the most power hungry IP in UMAP, so 96.7% of cluster power and 99.1% of target detection time are saved in real operation. Based on the 3-stage pipelined architecture with the dynamic mode reconfiguration technique, the entire UMAP achieves up to 64.4% of energy reduction compared to the previous state-of-the-art media processors in full operation.","1558-173X","","10.1109/JSSC.2013.2259042","","https://ieeexplore.ieee.org/stamp/stamp.jsp?arnumber=6518179","Augmented reality (AR);feature extraction;media application processor;mixed-mode;vision;3D display;3D graphics;3D-view AR","Three-dimensional displays;Media;Graphics;Parallel processing;Image analysis;Estimation;Vectors","augmented reality;computer graphics;computer vision;edge detection;feature extraction;multiprocessing systems;pipeline processing;stereo image processing","unified media application processor;dynamic analog-digital mode reconfiguration;embedded 3D-media contents processing;UMAP;2D image analysis;3D image analysis;image synthesis;parallel processing layer;sequential processing layer;heterogeneous functional IP;media content processing;heterogeneous many-core platform;vision processing;augmented reality;3D display synthesis;3D-view AR acceleration;stereo image;self-constructed disparity map;mobile device;homography-based disparity estimation algorithm;HDE algorithm;energy-efficient system organization;workload-balanced 3-stage pipelined architecture;mixed-mode feature extraction engine;3-stage pipelined system;graphics operation stage;vision operation stage;display operation stage;mixed-mode FEE;per-frame energy dissipation;energy-efficient 3D-view AR;corner detection;analog current contention logic;CCL;diode-connected current sensing stabilizer;CSS;2D-view AR processing;3D-view AR processing;dynamic mode reconfiguration technique;energy reduction","","2","","27","IEEE","22 May 2013","","","IEEE","IEEE Journals"
"An adaptive controller scheme implemented on multiple links VSC-HVDC for effective damping of low frequency power oscillations","Ayesha; B. Khan; K. Zeb; N. Zeb; R. Sajjad; M. Aqib; A. Haider; H. G. Abood; V. Sreeram","COMSATS University Islamabad, Islamabad, Islamabad, PK; COMSATS University Islamabad, Islamabad, Islamabad, PK; University of Management and Technology, Lahore, PK; Department of Electrical Engineering, COMSATS Institute of Information Technology, Abbottabad, Pakistan; COMSATS University Islamabad, Islamabad, Islamabad, PK; COMSATS University Islamabad, Islamabad, Islamabad, PK; University of Management and Technology, Lahore, PK; University of Western Australia, Perth, WA, AU; University of Western Australia, Perth, WA, AU","2016 IEEE International Conference on Power System Technology (POWERCON)","24 Nov 2016","2016","","","1","6","Inter-area power oscillation damping is of fundamental importance in today's era of sophisticated and highly complex power system. The present paper demonstrates a practical solution obtaining satisfactory performance in damping power system oscillations utilizing the flexible Voltage Source Converter-High Voltage Direct Current (HVDC-VSC) transmission technology in an optimal combination with a Power Oscillation Damping (POD) controller such as Nonlinear Autoregressive Moving Average (NARMA-L2), utilizing active power modulation technique. The primary focus of the control scheme is to improve the damping of lightly damped or even unstable modes of the interconnected AC/DC power system through modal identification and estimation techniques. The performance of aforesaid control technique is compared with that of conventionally tuned PI control scheme. The designed control scheme guarantees stability margins through eigenvalue analysis and non-linear time domain simulations during symmetrical and asymmetrical faults. The software platform under which the various simulation scenarios were implemented is MATLAB/Simulink.","","978-1-4673-8848-1","10.1109/POWERCON.2016.7754008","","https://ieeexplore.ieee.org/stamp/stamp.jsp?arnumber=7754008","Nonlinear Autoregressive Moving Average (NARMA-L2);Power Oscillation Damping (POD);High Voltage Direct Current (HVDC);Voltage Source Converter (VSC);Power System Stabilizers (PSS);Pulse Width Modulation (PWM)","Power conversion;Oscillators;Mathematical model;Power system stability;Damping;Autoregressive processes","autoregressive processes;eigenvalues and eigenfunctions;HVDC power convertors;HVDC power transmission;power transmission control;time-domain analysis","inter-area power oscillation damping;voltage source converter-high voltage direct current transmission technology;HVDC-VSC transmission technology;power oscillation damping controller;POD controller;nonlinear autoregressive moving average;NARMA-L2;active power modulation technique;interconnected AC-DC power system;modal identification;stability margins;eigenvalue analysis;nonlinear time domain simulations;asymmetrical faults","","","","25","IEEE","24 Nov 2016","","","IEEE","IEEE Conferences"
"On Cognitive Dynamic Systems: Cognitive Neuroscience and Engineering Learning From Each Other","S. Haykin; J. M. Fuster","Department of Electrical & Computer Engineering, McMaster University, Hamilton, ON, Canada; Semel Institute for Neuroscience and Human Behavior, University of California Los Angeles (UCLA), Los Angeles, CA, USA","Proceedings of the IEEE","25 Mar 2014","2014","102","4","608","628","Cognitive dynamic systems provide a broadly defined platform, whereby engineering learns from cognitive neuroscience, and by the same token, cognitive neuroscience learns from engineering. The first part of the paper is of a tutorial nature, addressing recent advances in cognitive perception and cognitive control, which are the dual of each other. The study of cognitive perception, viewed from the perspective of Bayesian inference, starts with sparse coding, well known in neuroscience. However, sparse coding could become ill-posed, particularly when the signal-to-noise ratio is low. In such situations, stability is a necessary requirement, which can only be satisfied if there is sufficient information in the observables. To satisfy this requirement, the sparse-coding algorithm is augmented by the addition of information filtering (i.e., a special case of Bayesian filtering). Accordingly, the performance of sparse coding is improved under the influence of perceptual attention. This improvement enhances the cognitive perceptor to separate relevant information from irrelevant information. Next, moving into cognitive control, viewed from the perspective of Bellman's dynamic programming, two ideas are exploited: entropic state of the perceptor, and the definition of reward as an invertible function of two entropic states, namely, the current state and its immediate past value. The net result of building on these two ideas is a modified form of Bellman's dynamic programming, and, therefore, a new reinforcement learning algorithm, which not only outperforms traditional reinforcement learning algorithms, but also offers some highly desirable properties. Among them is a linear law of computational complexity, which is the best that it could be. The second part of the paper addresses two challenging problems: first, how to mediate between cognitive control and cognitive perception and, second, how to formulate a procedure for risk control. The first problem is resolved by making use of probabilistic reasoning, a branch of probability theory, which leads into the formulation of a probabilistic reasoning machine. With this mediation in place, the conditions for overall system stability are derived, thereby confirming the probabilistic reasoning machine as the overall system stabilizer. The second challenge is risk control, which is by far the most challenging of them all: In the presence of an unexpected disturbance in the environment, risk is brought under control by mimicking the predict and preadapt function, which is considered to be the overarching function in the prefrontal cortex of the brain. To be specific, motor control is expanded by the inclusion of a new preadaptive control mechanism, which involves two different sets of actions: One set is made up of possible actions identified by the policy in the motor control. The other set involves a window of experiences (i.e., optimal actions) gained in the past. In a novel way, by exploiting these two sets, we end up with a preadaptive control mechanism in the form of a closed-loop feedback structure, which brings with it control (executive) attention.","1558-2256","","10.1109/JPROC.2014.2311211","","https://ieeexplore.ieee.org/stamp/stamp.jsp?arnumber=6777299","Attention;cognition;control;entropic state;intelligence;memory;perception;pre-adaptation;prediction;risk control;self-organization;system stability","Cognitive science;Neuroscience;Bayes methods;Probabilistic logic;Encoding;Thermal stability;Entropy;Predictive methods","belief networks;brain;closed loop systems;cognition;computational complexity;dynamic programming;entropy;feedback;inference mechanisms;learning (artificial intelligence);neurophysiology;probability","engineering learning;cognitive dynamic systems;cognitive neuroscience;cognitive perception;cognitive control;Bayesian inference;signal-to-noise ratio;sparse-coding algorithm;information filtering;Bayesian filtering;perceptual attention;Bellman dynamic programming;entropic state;reward;invertible function;reinforcement learning algorithm;linear law;computational complexity;risk control;probability theory;probabilistic reasoning machine;system stability;system stabilizer;brain prefrontal cortex;motor control;preadaptive control mechanism;closed-loop feedback structure","","62","","52","IEEE","21 Mar 2014","","","IEEE","IEEE Journals"
"Robust adaptive control design for quadcopter payload add and drop applications","B. J. Emran; J. Dias; L. Seneviratne; G. Cai","Robotics Institute, Khalifa University, Abu Dhabi, United Arab Emirates; Robotics Institute, Khalifa University, Abu Dhabi, United Arab Emirates; Robotics Institute, Khalifa University, Abu Dhabi, United Arab Emirates; Robotics Institute, Khalifa University of Science and Technology, Abu Dhabi, Abu Dhabi, AE","2015 34th Chinese Control Conference (CCC)","14 Sep 2015","2015","","","3252","3257","Payload add or drop occurs commonly in various quadcopter applications. Generally the control parameters of the onboard autopilot or stabilizer are tuned for a particular condition such as no payload or constant payload. Therefore, such mass change may significantly deteriorate the automatic control performance. In our work, a robust adaptive control method is proposed to deal with this challenging issue, aiming at 1) achieving a consistent performance for the altitude control of a quadcopter and 2) enhancing the robustness the system subject to signal noises. Using our custom built quadcopter platform as a case study, we demonstrate the efficiency of the proposed controller in terms of mass estimation, position tracking and velocity tracking via a series of simulations. Its superiority over the benchmark PID control is also highlighted via tracking performance comparison.","1934-1768","978-9-8815-6389-7","10.1109/ChiCC.2015.7260141","","https://ieeexplore.ieee.org/stamp/stamp.jsp?arnumber=7260141","Adaptive control;quadcopter UAV;payload add or drop;robustness enhancement","Adaptive control;Adaptation models;Aerodynamics;Robustness;Payloads;Noise;Noise measurement","adaptive control;autonomous aerial vehicles;control system synthesis;controllers;helicopters;position control;robust control;three-term control;velocity control","robust adaptive control design;quadcopter payload add and drop applications;control parameters;onboard autopilot;onboard stabilizer;automatic control performance;robust adaptive control method;quadcopter altitude control;mass estimation;position tracking;velocity tracking;benchmark PID control","","14","","23","","14 Sep 2015","","","IEEE","IEEE Conferences"
"Towards the design of a new humanoid robot for domestic applications","C. McGinn; M. Cullinan; D. Holland; K. Kelly","Dept. of Mechanical & Manuf. Engineering, Trinity College Dublin, Dublin, Ireland; Dept. of Mechanical & Manuf. Engineering, Trinity College Dublin, Dublin, Ireland; Dept. of Mechanical & Manuf. Engineering, Trinity College Dublin, Dublin, Ireland; Dept. of Mechanical & Manuf. Engineering, Trinity College Dublin, Dublin, Ireland","2014 IEEE International Conference on Technologies for Practical Robot Applications (TePRA)","4 Aug 2014","2014","","","1","6","Robots that possess the ability to undertake everyday tasks in domestic environments have the potential to provide unprecedented independence to disabled and elderly people who are currently reliant on other people to do these jobs for them. In addition to the ability to perform basic tasks, it is desirable that such robots possess some form of social interface such that users can interact with them in a natural manner. While many robot platforms have been developed to perform everyday tasks, few systems possess high levels of mechanical efficiency, system stability, practical functionality and a dynamic social interface. This work presents the novel design of a humanoid robot that uses wheels for locomotion and the combination of an actuated stabilizer and a self-balancing control algorithm to maintain stability. To validate some of the basic concepts in this design, a full scale working prototype was built and its performance was tested. It was found that despite being the first prototype of its type, it was capable of robust locomotion in indoor environments and was capable of traversing small bumps with relative ease. It was also very efficient at picking up small items that from the ground.","2325-0534","978-1-4799-4605-1","10.1109/TePRA.2014.6869155","","https://ieeexplore.ieee.org/stamp/stamp.jsp?arnumber=6869155","mobile robot;robot design;social interface;assistive robotics;self-balancing robot","Mobile robots;Joints;Robot kinematics;Wheels;Hip;Grippers","assisted living;control engineering computing;handicapped aids;humanoid robots;human-robot interaction;legged locomotion;robust control;self-adjusting systems;wheels","humanoid robot;domestic application;disabled people;elderly people;mechanical efficiency;system stability;practical functionality;dynamic social interface;wheels;actuated stabilizer;self-balancing control algorithm;robust locomotion;indoor environments","","6","","20","IEEE","4 Aug 2014","","","IEEE","IEEE Conferences"
"Design and Analysis of An Anthropomorphic Two-DoF Ankle-Foot Orthosis","R. K. P. S. Ranaweera; R. A. M. Abayasiri; R. A. R. C. Gopura; T. S. S. Jayawardena; G. K. I. Mann","Dept. of Mechanical Engineering, University of Moratuwa, Moratuwa, Sri Lanka; Dept. of Mechanical Engineering, University of Moratuwa, Moratuwa, Sri Lanka; Dept. of Mechanical Engineering, University of Moratuwa, Moratuwa, Sri Lanka; Dept. of Textile and Clothing Technology, University of Moratuwa, Moratuwa, Sri Lanka; Faculty of Engineering and Applied Science, Memorial University of Newfoundland, Canada","2019 5th International Conference on Control, Automation and Robotics (ICCAR)","29 Aug 2019","2019","","","802","807","This paper proposes a two-degrees of freedom passive-dynamic ankle-foot orthosis (AFO). In view of enhancing anatomical conformity, an anthropomorphic design is proposed to minimize mechanical interferences between ankle and orthosis. The biomimetic features such as passive stabilizers and dampeners in the proposed mechanism intrinsically support the ankle and foot to maintain stability and improve shock-absorbing ability. The mobility, ranges of motion, and manipulability measures for the proposed AFO have been investigated using mathematical modeling and simulation approaches. The analysis revealed the effectiveness of the proposed AFO in meeting the complex kinematics of ankle joint compared to the predecessors. Potentially, the proposed AFO can serve as a platform to carry out research and development on robotic orthoses for the lower extremity.","2251-2446","978-1-7281-3326-3","10.1109/ICCAR.2019.8813375","","https://ieeexplore.ieee.org/stamp/stamp.jsp?arnumber=8813375","ankle and foot;anthropomorphic;biomimetic;manipulability;mechanism;orthosis;passive-dynamic","","biomimetics;gait analysis;medical robotics;orthotics","lower extremity;robotic orthoses;mechanical interferences;anthropomorphic design;anatomical conformity;freedom passive-dynamic ankle-foot orthosis;anthropomorphic two-DoF ankle-foot;ankle joint;mathematical modeling;shock-absorbing ability;dampeners;passive stabilizers;biomimetic features","","","","23","IEEE","29 Aug 2019","","","IEEE","IEEE Conferences"
