"A remote operating system of an unmanned military robot for indoor test environment","Sung-Soo Kim; Sunwoo Kim; Heechan Kang; Myeongcheol Oh","Dept. of Mechatronics Engineering, Chungnam National University, Korea; Graduate School of Mechanical Design and Mechatronics Engineering, Chungnam National University, Korea; Graduate School of Mechanical Design and Mechatronics Engineering, Chungnam National University, Korea; Graduate School of Mechanical Design and Mechatronics Engineering, Chungnam National University, Korea","IEEE ISR 2013","2 Jan 2014","2013","","","1","4","A camera based remote operating system of a 6×6 unmanned military robot vehicle has been developed for indoor test environment. The system consists of an operator console, a 6-axis motion platform (driving simulator), a 3-axis camera stabilizer, a real-time model for the unmanned military robot vehicle, and virtual environment for a bump course. In order to investigate the effectiveness of the developed system, bump course tests have been carried out. Operators driving ability has been also investigated with and without the control of the 3-axis camera stabilizer. Without the camera stabilizer, it is shown that remote operation is only possible with very slow speed, whereas with the camera stabilization control, operators can drive the vehicle with the moderate speeds.","","978-1-4799-1173-8","10.1109/ISR.2013.6695665","","https://ieeexplore.ieee.org/stamp/stamp.jsp?arnumber=6695665","Remote operating system;Unmanned Military Robot;3-axis Camera Stabilizer","Robot sensing systems;Vehicles;Cameras;Indexes;Life estimation;Collision avoidance","cameras;computerised instrumentation;indoor environment;military vehicles;mobile robots;remotely operated vehicles;robot vision;stability;virtual reality","remote operating system;indoor test environment;unmanned military robot vehicle real-time model;operator console;6-axis motion platform;driving simulator;3 axis camera stabilizer;virtual environment;bump course tests;operator driving ability;3 axis camera stabilizer;camera stabilization control","","","","8","IEEE","2 Jan 2014","","","IEEE","IEEE Conferences"
"Effect of Space Charge on Electrical Tree Initiation in XLPE/Voltage Stabilizer Composites Under AC Voltage","T. Han; Q. Li; X. Zhao; Y. Yao; J. Li; Y. Gao","National Industry-Education Platform of Energy Storage, Tianjin University, Tianjin, China; School of Electrical and Information Engineering, Tianjin University, Tianjin, China; School of Electrical and Information Engineering, Tianjin University, Tianjin, China; School of Electrical and Information Engineering, Tianjin University, Tianjin, China; School of Electrical and Information Engineering, Tianjin University, Tianjin, China; School of Electrical and Information Engineering, Tianjin University, Tianjin, China","IEEE Transactions on Dielectrics and Electrical Insulation","28 Sep 2023","2023","30","5","2173","2180","The space charge dynamic characteristic is a critical factor in electrical treeing under ac voltage, especially in the initiation stage. This article explains a method to analyze the effect of space charge on tree initiation. Crosslinked polyethylene (XLPE) composite samples with different contents of voltage stabilizer were prepared. The electrical tree inception voltage of each sample was measured with the needle-plate electrode. The space charge distribution characteristics of the composites were measured by a pulsed electroacoustic (PEA) system with an extremely fast pulse burst under ac. In addition, trap distribution characteristics were studied by the isothermal surface potential decay (ISPD) method. The results show that the voltage stabilizer inhibited tree initiation, and the optimum content was 0.5 wt%. The detected space charge near the electrodes decreased significantly from the voltage stabilizer, and the traps induced by the voltage stabilizer were inferred to be the main reason. In addition, it was confirmed that the calculated average bulk charge density had a negative correlation with the tree inception voltage, which could be a supporting datum for the ac tree initiation mechanism.","1558-4135","","10.1109/TDEI.2023.3271277","National Nature Science Foundation of China (NSFC)(grant numbers:52077151); Natural Science Foundation of Tianjin(grant numbers:20JCYBJC00840); ","https://ieeexplore.ieee.org/stamp/stamp.jsp?arnumber=10109711","AC voltage;electrical tree;space charge;trap energy;voltage stabilizer","Space charge;Voltage measurement;Charge measurement;Phase measurement;Electrodes;Temperature measurement;Needles","electrodes;power cable insulation;pulsed electroacoustic methods;space charge;surface potential;trees (electrical);XLPE insulation","ac tree initiation mechanism;ac voltage;calculated average bulk charge density;crosslinked polyethylene composite samples;detected space charge;electrical tree inception voltage;electrical tree initiation;electrical treeing;initiation stage;isothermal surface potential decay method;space charge distribution characteristics;space charge dynamic characteristic;trap distribution characteristics","","1","","31","IEEE","27 Apr 2023","","","IEEE","IEEE Journals"
"Plane wave scattering from a partially coated air platform using a non-overlapping surface integral equation domain decomposition method","Z. Peng; J. -F. Lee","ECE Department, ElectroScience Laboratory, Columbus, OH, USA; ECE Department, ElectroScience Laboratory, Columbus, OH, USA","2011 International Conference on Electromagnetics in Advanced Applications","17 Oct 2011","2011","","","1412","1415","We address in detail the numerical simulations of electromagnetic (EM) wave scattering from a mockup partly coated fighter jet in this presentation. The majority part of the fighter jet surface is considered to be perfect electric conductor (PEC). The horizontal stabilizer, vertical stabilizer and the wings are coated with high-density materials, whereas a hollow dielectric radome is located at the front of the aircraft. Due to the nature of unbounded problem domain, and the desire to avoid a three dimensional discretization, we attempt to compute the numerical approximation using the boundary integral equations (BIEs), or the method of moments (MoM). However, it turns out not to be an easy quest. In the presentation, we shall elucidate difficulties that we have encountered and innovative techniques that we have devised during our journey to solve such a challenging mutli-scale EM application.","","978-1-61284-978-2","10.1109/ICEAA.2011.6046287","","https://ieeexplore.ieee.org/stamp/stamp.jsp?arnumber=6046287","","Integral equations;Electromagnetic scattering;Dielectrics;Aircraft;Equations;Magnetic fields","boundary integral equations;electromagnetic wave scattering;method of moments;military aircraft;radomes","plane wave scattering;partially coated air platform;nonoverlapping surface integral equation;domain decomposition;numerical simulations;electromagnetic wave scattering;mockup partly coated fighter jet;fighter jet surface;perfect electric conductor;horizontal stabilizer;vertical stabilizer;wings;hollow dielectric radome;aircraft;unbounded problem domain;three dimensional discretization;numerical approximation;boundary integral equations;method of moments","","","","5","IEEE","17 Oct 2011","","","IEEE","IEEE Conferences"
"Research on the experiment of fin stabilizer-anti rolling tank integrated stabilization test devices","L. Yu; X. Meng","Department of Automation, Harbin Engineering University, Harbin, P. R. China; Department of Automation, Harbin Engineering University, Harbin, P. R. China","The 2011 IEEE/ICME International Conference on Complex Medical Engineering","16 Jun 2011","2011","","","666","671","The fin stabilizer-anti rolling tank integrated stabilization devices are full speed stabilization facilities, it is very important and significance to research on the experiment of the integrated stabilization devices based on theory study. After the mathematical module of the devices was analyzed by simulations, the test platform was set up, and the integrated stabilization experiment effect of the test platform was researched. The simulation results and the experiment curves are good consistency, the advantages of using integrated stabilization devices to make up disadvantages of using single stabilization device are revealed, it is shown that the integrated stabilization devices have better stabilization effect at each speed, these can provide basis for ship equipped with integrated stabilization devices.","","978-1-4244-9324-1","10.1109/ICCME.2011.5876824","","https://ieeexplore.ieee.org/stamp/stamp.jsp?arnumber=5876824","integrated stabilization;test device;simulation analyze;experiment research","Artificial intelligence;Gyroscopes","ships;stability;test equipment","fin stabilizer;antirolling tank integrated stabilization test device;full speed stabilization facility;ship operation","","","","6","IEEE","16 Jun 2011","","","IEEE","IEEE Conferences"
"CordVIEW II: A New Fine-Diameter Cord-Like Vehicle System for Search and Inspection in Exploring Workspace, Mark II –Basic Functional Segments, Integration, and Image/Maneuvering Stabilizer–","X. -Z. Zheng; S. Watanabe","Division of Research and Development, ASTEM Research Institute, Kyoto, Japan; Division of Research and Development, ASTEM Research Institute, Kyoto, Japan","2018 IEEE International Conference on Information and Automation (ICIA)","26 Aug 2019","2018","","","385","390","Technology challenges of mobility capability and search ability of fine-diameter cord-like robot for disaster response are raised and open for further research and development in TRC Program. A new Leading Active Mechanism was designed to meet the requirements of diameter reduction and specification enhancement of the robot, and was integrated with the robot platform of the Program for solution to the technology challenges and for enlargement of robot capabilities as well. An Image and Maneuvering Stabilizer was further developed and installed as an operational assistance for the robot. Experimental results in both laboratory mock tests and outdoor realistic field evaluation are depicted.","","978-1-5386-8069-8","10.1109/ICInfA.2018.8812325","","https://ieeexplore.ieee.org/stamp/stamp.jsp?arnumber=8812325","Tough robotics challenge;fine-diameter cord-like robot;disaster response;Leading Active Mechanism (LAM);Image and Maneuvering Stabilizer (IMS)","Cameras;Robot vision systems;Propulsion;Robot kinematics;Motion control","design engineering;disasters;emergency management;image segmentation;mobile robots;motion control;robot vision","robot platform;robot capabilities;CordVIEW II;fine-diameter cord-like vehicle system;inspection;mobility capability;search ability;disaster response;TRC Program;diameter reduction;leading active mechanism;image and maneuvering stabilizer","","","","16","IEEE","26 Aug 2019","","","IEEE","IEEE Conferences"
"Real-Time Implementation of Intelligent Modeling and Control Techniques on a PLC Platform","C. Parrot; G. K. Venayagamoorthy","Missouri University of Science and Technology, Rolla, MO, US; Real-Time Power and Intelligent Systems Laboratory, Missouri University of Science and Technology, Rolla, MO, USA","2008 IEEE Industry Applications Society Annual Meeting","24 Oct 2008","2008","","","1","7","Programmable logic controllers (PLCs) have been used for many decades for standard control in industrial and factory environments. Over the years, PLCs have become computational efficient and powerful, and a robust platform with applications beyond the standard control and factory automation. Due to the new advanced PLC's features and computational power, they are ideal platforms for exploring advanced modeling and control methods, including computational intelligence based techniques such as neural networks, particle swarm optimization (PSO) and many others. Some of these techniques require fast floating-point calculations that are now possible in real-time on the PLC. This paper focuses on the Allen-Bradley ControlLogix brand of PLCs, due to their high performance and extensive use in industry. The design and implementation of a neurocontroller consisting of two neural networks, one for modeling and the other for control, and the training of these neural networks with particle swarm optimization is presented in this paper on a single PLC. The neurocontroller in this study is a power system stabilizer (PSS) that is used for power system oscillation damping. The PLC is interfaced to a power system simulated on the real time digital simulator. Real time results are presented showing that the PLC is a suitable hardware platform for implementing advanced modeling and control techniques for industrial applications.","0197-2618","978-1-4244-2278-4","10.1109/08IAS.2008.164","","https://ieeexplore.ieee.org/stamp/stamp.jsp?arnumber=4658952","","Intelligent control;Programmable control;Power system modeling;Power system simulation;Automatic control;Industrial control;Neural networks;Industrial power systems;Computational intelligence;Particle swarm optimization","damping;floating point arithmetic;neurocontrollers;particle swarm optimisation;power system control;programmable controllers;stability","intelligent modeling;intelligent control techniques;PLC platform;programmable logic controllers;particle swarm optimization;floating-point calculations;neurocontroller;power system stabilizer;power system oscillation damping","","10","","11","IEEE","24 Oct 2008","","","IEEE","IEEE Conferences"
"Application and comparison of switching control algorithms for power system stabilizer","Yathisha L; S. S. P. Kulkarni","Electronics & Communication Department, S J College of Engineering, Mysuru; Electronics & Communication Department, S J College of Engineering, Mysuru, India","2015 International Conference on Industrial Instrumentation and Control (ICIC)","9 Jul 2015","2015","","","1300","1305","An application of two switching control algorithms for the power system stabilizer (PSS) is introduced in this paper to enhance damping during low frequency oscillations in a power system followed by the comparison of the results due to these algorithms. Algorithm 1, is based on Lyapunov's stability theorem while algorithm 2, switches such a way that state trajectory is driven on to (n-1) dimensional stable hyper-plane. In the context of power systems, experimental comparison of the two switching algorithms promises theoretical insights for better algorithms in future. The feedback switching control models presented here is tested on the SMIB linearised phillips heffron model of a power system using MATLAB/SIMULINK @ platform.","","978-1-4799-7165-7","10.1109/IIC.2015.7150949","","https://ieeexplore.ieee.org/stamp/stamp.jsp?arnumber=7150949","PSS;SMIB;Phillips Heffron Model;LQR;Pole placement;Sw 1 & Sw 2","Switches;Heating","Lyapunov methods;power system stability;time-varying systems","switching control algorithms;power system stabilizer;PSS;low frequency oscillations;Lyapunov stability theorem;feedback switching control models;MATLAB;SIMULINK","","6","","15","IEEE","9 Jul 2015","","","IEEE","IEEE Conferences"
"Design of wide-area power system stabilizer considering packet drops","S. Rasheed; V. P. Singh","Electrical Department, National Institute Technology, Raipur Raipur, India; Electrical Department, National Institute Technology, Raipur Raipur, India","2019 3rd International Conference on Computing Methodologies and Communication (ICCMC)","29 Aug 2019","2019","","","1046","1050","Wide area monitoring systems (WAMS) serves as a platform to integrate the communication network with power system networks, along with its advantages WAMS adds some unavoidable constraints like delay and packet losses to the transmitted data which may affect the wide area power system stabilizer (WAPSS) performance. In WAMS, signals are sensed by phasor measurement units (PMUs) and transmitted to phasor data concentrators (PDCs) as packets with a time tag using Transmission Control Protocol (TCP) or User Datagram Protocol (UDP). Data is stored and aligned with respect to its time tag in PDC, when the packet drop occurs it results into absence of data at that particular instant and causes vacancies. In this paper, moving average method is proposed in order to estimate these vacancies. The estimated remote signal is used as input instead of signal with drops. The tuning of WAPSS is done by slap swarm algorithm (SSA) considering integral time absolute speed deviation (ISD) as objective function. Case study is under taken by considering two-area four-machine system under different test scenarios. The simulation results prove the satisfactory performance of proposed approach regarding inter-area oscillation damping.","","978-1-5386-7808-4","10.1109/ICCMC.2019.8819730","","https://ieeexplore.ieee.org/stamp/stamp.jsp?arnumber=8819730","wide area monitoring system;transmission control protocol;user data gram protocol;packet drops","","damping;delays;losses;oscillations;phasor measurement;power system control;power system stability;telecommunication networks;transport protocols","two-area four-machine system;packet drop;wide area monitoring systems;communication network;power system networks;packet losses;wide area power system stabilizer performance;phasor measurement units;remote signal;integral time absolute speed deviation;inter-area oscillation damping;WAMS;WAPSS;PMU;phasor data concentrator;PDC;transmission control protocol;TCP;user datagram protocol;UDP;slap swarm algorithm;SSA;ISD;delay","","1","","14","IEEE","29 Aug 2019","","","IEEE","IEEE Conferences"
"Analysis of sensor platform dynamics in ground vehicle","S. Mattila; J. Kostamo; E. Porkka; P. Kuosmanen; H. Heikkila","Helsinki University of Technology, Finland; Helsinki University of Technology, Finland; Helsinki University of Technology, Finland; Helsinki University of Technology, Finland; Armoured Brigade, Finland","IEEE Aerospace and Electronic Systems Magazine","18 Sep 2006","2006","21","8","9","14","A vehicular platform's dynamical behavior is analyzed as a basis for designing a laboratory test apparatus and an associated 2-dimensional orthogonal stabilizer. The test track caused inclination in the front direction to vary from -6.5/spl deg/ to 7.2/spl deg/ and from -5.5/spl deg/ to 5.0/spl deg/ in the side direction. The maximum angular rate was 19.8 /spl plusmn/ 0.1/spl deg//s in the front direction within a bandwidth of 0-2.5 Hz and 14.4 /spl plusmn/ 0.05/spl deg//s in the side direction. The platform's natural frequency in the front direction was found to be 0.8-1.0 Hz. In the side direction the most significant rate values appeared within 0-4 Hz but the natural frequency did not wake. Inclination measurements were based on sensor fusion where the basic model of stochastic Kalman filtering was applied.","1557-959X","","10.1109/MAES.2006.1703230","","https://ieeexplore.ieee.org/stamp/stamp.jsp?arnumber=1703230","","Vehicle dynamics;Land vehicles;Testing;Frequency;Laboratories;Bandwidth;Sensor fusion;Stochastic processes;Kalman filters;Filtering","test equipment;sensor fusion;Kalman filters;angular velocity measurement","sensor platform dynamics;ground vehicle;2D orthogonal stabilizer;inclination measurements;sensor fusion;stochastic Kalman filtering;0 to 2.5 Hz;0 to 4 Hz","","","","9","IEEE","18 Sep 2006","","","IEEE","IEEE Magazines"
"Mitigating Coherent Noise by Balancing Weight-2 Z-Stabilizers","J. Hu; Q. Liang; N. Rengaswamy; R. Calderbank","Department of Mathematics, Duke University, Durham, NC, USA; Department of Mathematics, Duke University, Durham, NC, USA; Department of Electrical and Computer Engineering, Duke University, Durham, NC, USA; Department of Mathematics, Duke University, Durham, NC, USA","IEEE Transactions on Information Theory","17 Feb 2022","2022","68","3","1795","1808","Physical platforms such as trapped ions suffer from coherent noise that does not follow a simple stochastic model. Stochastic errors in quantum systems occur randomly but coherent errors are more damaging since they can accumulate in a particular direction. We consider coherent noise acting transversally, giving rise to an effective error which is a  $Z$ -rotation on each qubit by some angle  $\theta $ . Rather than address coherent noise through active error correction, we investigate passive mitigation through decoherence free subspaces. In the language of stabilizer codes, we require the noise to preserve the code space, and to act trivially (as the logical identity operator) on the protected information. Thus, we develop necessary and sufficient conditions for all transversal  $Z$ -rotations to preserve the code space of a stabilizer code. These conditions require the weight- $2~Z$ -stabilizers to cover all the qubits that are in the support of the  $X$ -component of some stabilizer. Furthermore, the weight- $2~Z$ -stabilizers generate a direct product of single-parity-check codes with even block length. By adjusting the sizes of these components, we are able to construct a large family of QECC codes oblivious to coherent noise, one that includes the  $[[4L^{2}, 1, 2L]]$  Shor codes. The Shor codes are examples of constant excitation codes, where logical qubits are encoded as a code state that is a sum of physical states indexed by binary vectors with the same weight. Constant excitation codes are oblivious to coherent noise since a transversal  $Z$ -rotation acts as a global phase. We prove that a CSS code is oblivious to coherent noise if and only if it is a constant excitation code, and that if the code is error-detecting, then the (constant) weights in different cosets of the  $X$ -stabilizers are identical.","1557-9654","","10.1109/TIT.2021.3130155","National Science Foundation (NSF)(grant numbers:CCF-2106213,CCF-1908730); ","https://ieeexplore.ieee.org/stamp/stamp.jsp?arnumber=9624967","Coherent noise;decoherence-free subspace (DFS);transversal Z-rotations;necessary conditions;constant excitation code","Codes;Qubit;Computers;Product codes;Stochastic processes;Quantum system;Ions","error correction;error correction codes;parity check codes;quantum communication;quantum computing;stochastic processes","stabilizer code;single-parity-check codes;QECC codes;Shor codes;constant excitation code;code state;coherent noise;balancing weight-2 Z-stabilizers;stochastic errors;code space","","3","","40","IEEE","23 Nov 2021","","","IEEE","IEEE Journals"
"Underwater Target Tracking Control of an Untethered Robotic Fish With a Camera Stabilizer","J. Yu; Z. Wu; X. Yang; Y. Yang; P. Zhang","Department of Mechanics and Engineering Science, BIC-ESAT, College of Engineering, State Key Laboratory for Turbulence and Complex Systems, Peking University, Beijing, China; State Key Laboratory of Management and Control for Complex Systems, Institute of Automation, Chinese Academy of Sciences, Beijing, China; State Key Laboratory of Management and Control for Complex Systems, Institute of Automation, Chinese Academy of Sciences, Beijing, China; State Key Laboratory of Management and Control for Complex Systems, Institute of Automation, Chinese Academy of Sciences, Beijing, China; State Key Laboratory of Management and Control for Complex Systems, Institute of Automation, Chinese Academy of Sciences, Beijing, China","IEEE Transactions on Systems, Man, and Cybernetics: Systems","15 Sep 2021","2021","51","10","6523","6534","Implementing underwater target tracking remains difficult for a free-swimming robotic fish owing to the intrinsically reciprocating motion in fishlike propulsion. In this article, we present a novel robotic fish platform with a camera stabilizing system and achieve real-time two-dimensional target tracking assisted by reinforcement learning (RL) in continuous environments. More specifically, we first develop an active visual tracking system based on cascade control structure to obtain the relative orientation between the robotic fish and the underwater target. Then, we propose a target tracking controller dealing with continuous state and action spaces based on deep RL (DRL). The controller takes the position of the target object as input and yields the motion parameters of the bioinspired central pattern generator governed robotic fish. The robustness and adaptability of the proposed controller as well as the influence of time-delays on the control system are explored via simulated experiments under different scenarios. Finally, both static and dynamic tracking experiments on the actual robotic fish demonstrate the effectiveness of the proposed mechatronic design and control methods, providing insights to executing aquatic vision-based tracking tasks.","2168-2232","","10.1109/TSMC.2019.2963246","National Natural Science Foundation of China(grant numbers:61725305,U1909206,61633020,61633004,61973303); Preresearch Fund of Equipment of China(grant numbers:61402070304); ","https://ieeexplore.ieee.org/stamp/stamp.jsp?arnumber=8957237","Active visual tracking;camera stabilizer;reinforcement learning (RL);robotic fish;underwater target tracking","Cameras;Robot vision systems;Target tracking;Oscillators;Sports","autonomous underwater vehicles;cascade control;control engineering computing;control system synthesis;deep learning (artificial intelligence);mechatronics;mobile robots;motion control;position control;robot kinematics;robot vision;target tracking","untethered robotic fish;camera stabilizer;robotic fish platform;camera stabilizing system;visual tracking system;cascade control structure;target tracking controller;target object position;mechatronic design;underwater target tracking control;deep RL;reinforcement learning;motion parameters","","23","","36","IEEE","13 Jan 2020","","","IEEE","IEEE Journals"
